{
  "format": "boris-publication-checks",
  "schema_version": 1,
  "target": "default",
  "artifact_inventory": {
    "path": "_boris/proof/artifacts.json",
    "bytes": 10575,
    "sha256": "c9a7d59e89ec42d89df8bce062e4ab1566d127c7b7d75b5de26e5d82244c8bfa",
    "format": "boris-publication-artifacts",
    "schema_version": 1,
    "target": "default",
    "artifact_count": 29
  },
  "checks": [
    {
      "id": "artifact-integrity",
      "eligible": true,
      "ran": true,
      "status": "passed",
      "coverage": "complete",
      "scope": {
        "subject_statuses": ["committed"],
        "subject_kinds": [],
        "subject_sha256": "7e0c8c3cfae1bdbe09a019f0225203924306858f7483de5e91eda94bb0618944",
        "supporting_statuses": [],
        "supporting_kinds": [],
        "supporting_sha256": "e3b0c44298fc1c149afbf4c8996fb92427ae41e4649b934ca495991b7852b855"
      },
      "counts": {"eligible": 29, "checked": 29, "findings": 0},
      "finding_offset": 0
    },
    {
      "id": "rendered-html",
      "eligible": true,
      "ran": true,
      "status": "passed",
      "coverage": "complete",
      "scope": {
        "subject_statuses": ["committed"],
        "subject_kinds": ["html-page"],
        "subject_sha256": "07289078c2a777cdc19099afd57c462b868ef988a42ed15d083c8cf6df729f6c",
        "supporting_statuses": ["committed"],
        "supporting_kinds": [],
        "supporting_sha256": "7e0c8c3cfae1bdbe09a019f0225203924306858f7483de5e91eda94bb0618944"
      },
      "counts": {"eligible": 24, "checked": 24, "findings": 0},
      "finding_offset": 0
    },
    {
      "id": "rendered-search",
      "eligible": true,
      "ran": true,
      "status": "passed",
      "coverage": "complete",
      "scope": {
        "subject_statuses": ["committed"],
        "subject_kinds": ["rendered-search"],
        "subject_sha256": "c9b3d98b68466dc5dc32983782492acf9f35f54908f20ef74d26ae3db03f1662",
        "supporting_statuses": ["committed"],
        "supporting_kinds": ["html-page"],
        "supporting_sha256": "07289078c2a777cdc19099afd57c462b868ef988a42ed15d083c8cf6df729f6c"
      },
      "counts": {"eligible": 1, "checked": 1, "findings": 0},
      "finding_offset": 0
    }
  ],
  "findings": [  ]
}
