{
  "format": "boris-publication-checks",
  "schema_version": 1,
  "target": "default",
  "artifact_inventory": {
    "path": "_boris/proof/artifacts.json",
    "bytes": 2805,
    "sha256": "d09020a8d1fc9395eac5f109a3026b6fca4ed82602bd48136c16131359213405",
    "format": "boris-publication-artifacts",
    "schema_version": 1,
    "target": "default",
    "artifact_count": 7
  },
  "checks": [
    {
      "id": "artifact-integrity",
      "eligible": true,
      "ran": true,
      "status": "passed",
      "coverage": "complete",
      "scope": {
        "subject_statuses": ["committed"],
        "subject_kinds": [],
        "subject_sha256": "6d3b302543c083c7a74bab66dc1d027cf693bc5f02672dabde354c5a0b31eb22",
        "supporting_statuses": [],
        "supporting_kinds": [],
        "supporting_sha256": "e3b0c44298fc1c149afbf4c8996fb92427ae41e4649b934ca495991b7852b855"
      },
      "counts": {"eligible": 7, "checked": 7, "findings": 0},
      "finding_offset": 0
    },
    {
      "id": "rendered-html",
      "eligible": true,
      "ran": true,
      "status": "passed",
      "coverage": "complete",
      "scope": {
        "subject_statuses": ["committed"],
        "subject_kinds": ["html-page"],
        "subject_sha256": "21b4f3fb54d51d81e0c749bc3b73cfd97db98dc39823fa34b81bcee73b3130f6",
        "supporting_statuses": ["committed"],
        "supporting_kinds": [],
        "supporting_sha256": "6d3b302543c083c7a74bab66dc1d027cf693bc5f02672dabde354c5a0b31eb22"
      },
      "counts": {"eligible": 6, "checked": 6, "findings": 0},
      "finding_offset": 0
    },
    {
      "id": "rendered-search",
      "eligible": true,
      "ran": true,
      "status": "passed",
      "coverage": "complete",
      "scope": {
        "subject_statuses": ["committed"],
        "subject_kinds": ["rendered-search"],
        "subject_sha256": "094834f25850c2bac02e6e7c9ec16a02ee208552f25907494b23350197bcd700",
        "supporting_statuses": ["committed"],
        "supporting_kinds": ["html-page"],
        "supporting_sha256": "21b4f3fb54d51d81e0c749bc3b73cfd97db98dc39823fa34b81bcee73b3130f6"
      },
      "counts": {"eligible": 1, "checked": 1, "findings": 0},
      "finding_offset": 0
    }
  ],
  "findings": [  ]
}
